{
  "strategy_type": "ConstantStepOffset",
  "baseline": 47.86,
  "stepDelta": 0.02,
  "executionLimitOffset": 10.0,
  "stateTransitionThreshold": 0.01,
  "orderQuantityInUSD": 300.0,
  "orderQuantity": 6,
  "contract": {
    "symbol": "FISV",
    "secType": "STOCK",
    "currency": "USD",
    "exchange": "IBKR"
  },
  "price_contract": {
    "symbol": "FISV",
    "secType": "STOCK",
    "currency": "USD",
    "exchange": "IBKR"
  },
  "ledgerPath": "data/TraderLedger/CSO_SP500_300_FISV_TWS",
  "ledgerContextCollection": "CSO_SP500_300_FISV_TWS_context"
}
