{
  "strategy_type": "ConstantStepOffset",
  "baseline": 58.23,
  "stepDelta": 0.08,
  "executionLimitOffset": 1.6,
  "stateTransitionThreshold": 0.02,
  "orderQuantityInUSD": 1000.0,
  "orderQuantity": 17.17328,
  "contract": {
    "symbol": "LTC",
    "secType": "CRYPTO",
    "currency": "USD",
    "exchange": "IBKR"
  },
  "price_contract": {
    "symbol": "LTC",
    "secType": "CRYPTO",
    "currency": "USD",
    "exchange": "IBKR"
  },
  "ledgerPath": "data/TraderLedger/CSO_LTC_CRYPTO_STRESS_03_TWS.sqlite",
  "ledgerContextCollection": "CSO_LTC_CRYPTO_STRESS_03_TWS_context"
}
