{
  "strategy_type": "ConstantStepOffset",
  "baseline": 82.5,
  "stepDelta": 0.04,
  "executionLimitOffset": 20.0,
  "stateTransitionThreshold": 0.01,
  "orderQuantityInUSD": 300.0,
  "orderQuantity": 3,
  "contract": {
    "symbol": "EVRG",
    "secType": "STOCK",
    "currency": "USD",
    "exchange": "IBKR"
  },
  "price_contract": {
    "symbol": "EVRG",
    "secType": "STOCK",
    "currency": "USD",
    "exchange": "IBKR"
  },
  "ledgerPath": "data/TraderLedger/CSO_SP500_300_EVRG_TWS",
  "ledgerContextCollection": "CSO_SP500_300_EVRG_TWS_context"
}
