{
  "strategy_type": "ConstantStepOffset",
  "baseline": 73.38,
  "stepDelta": 0.04,
  "executionLimitOffset": 20.0,
  "stateTransitionThreshold": 0.01,
  "orderQuantityInUSD": 300.0,
  "orderQuantity": 4,
  "contract": {
    "symbol": "CMS",
    "secType": "STOCK",
    "currency": "USD",
    "exchange": "IBKR"
  },
  "price_contract": {
    "symbol": "CMS",
    "secType": "STOCK",
    "currency": "USD",
    "exchange": "IBKR"
  },
  "ledgerPath": "data/TraderLedger/CSO_SP500_300_CMS_TWS",
  "ledgerContextCollection": "CSO_SP500_300_CMS_TWS_context"
}
