{
  "strategy_type": "ConstantStepOffset",
  "baseline": 249.1,
  "stepDelta": 0.12,
  "executionLimitOffset": 60.0,
  "stateTransitionThreshold": 0.03,
  "orderQuantityInUSD": 300.0,
  "orderQuantity": 1,
  "contract": {
    "symbol": "IBM",
    "secType": "STOCK",
    "currency": "USD",
    "exchange": "IBKR"
  },
  "price_contract": {
    "symbol": "IBM",
    "secType": "STOCK",
    "currency": "USD",
    "exchange": "IBKR"
  },
  "ledgerPath": "data/TraderLedger/CSO_SP500_300_IBM_TWS",
  "ledgerContextCollection": "CSO_SP500_300_IBM_TWS_context"
}
