{
  "strategy_type": "ConstantStepOffset",
  "baseline": 2292.04,
  "stepDelta": 1.8,
  "executionLimitOffset": 36,
  "stateTransitionThreshold": 0.25,
  "orderQuantityInUSD": 1000.0,
  "contract": {
    "symbol": "ETH",
    "secType": "CRYPTO",
    "currency": "USD",
    "exchange": "IBKR"
  },
  "price_contract": {
    "symbol": "ETH",
    "secType": "CRYPTO",
    "currency": "USD",
    "exchange": "IBKR"
  },
  "ledgerPath": "data/TraderLedger/CSO_ETH_CRYPTO_STRESS_03_TWS.csv",
  "ledgerContextCollection": "CSO_ETH_CRYPTO_STRESS_03_TWS_context"
}
