{
  "strategy_type": "ConstantStepOffset",
  "baseline": 172.63,
  "stepDelta": 0.09,
  "executionLimitOffset": 45.0,
  "stateTransitionThreshold": 0.02,
  "orderQuantityInUSD": 300.0,
  "orderQuantity": 1,
  "contract": {
    "symbol": "HSY",
    "secType": "STOCK",
    "currency": "USD",
    "exchange": "IBKR"
  },
  "price_contract": {
    "symbol": "HSY",
    "secType": "STOCK",
    "currency": "USD",
    "exchange": "IBKR"
  },
  "ledgerPath": "data/TraderLedger/CSO_SP500_300_HSY_TWS",
  "ledgerContextCollection": "CSO_SP500_300_HSY_TWS_context"
}
