{
  "strategy_type": "ConstantStepOffset",
  "baseline": 226.11,
  "stepDelta": 0.11,
  "executionLimitOffset": 55.0,
  "stateTransitionThreshold": 0.03,
  "orderQuantityInUSD": 300.0,
  "orderQuantity": 1,
  "contract": {
    "symbol": "QCOM",
    "secType": "STOCK",
    "currency": "USD",
    "exchange": "IBKR"
  },
  "price_contract": {
    "symbol": "QCOM",
    "secType": "STOCK",
    "currency": "USD",
    "exchange": "IBKR"
  },
  "ledgerPath": "data/TraderLedger/CSO_SP500_300_QCOM_TWS",
  "ledgerContextCollection": "CSO_SP500_300_QCOM_TWS_context"
}
