{
  "strategy_type": "ConstantStepOffset",
  "baseline": 79.29,
  "stepDelta": 0.04,
  "executionLimitOffset": 20.0,
  "stateTransitionThreshold": 0.01,
  "orderQuantityInUSD": 300.0,
  "orderQuantity": 3,
  "contract": {
    "symbol": "GM",
    "secType": "STOCK",
    "currency": "USD",
    "exchange": "IBKR"
  },
  "price_contract": {
    "symbol": "GM",
    "secType": "STOCK",
    "currency": "USD",
    "exchange": "IBKR"
  },
  "ledgerPath": "data/TraderLedger/CSO_SP500_300_GM_TWS",
  "ledgerContextCollection": "CSO_SP500_300_GM_TWS_context"
}
