{
  "strategy_type": "ConstantStepOffset",
  "baseline": 59.1,
  "stepDelta": 0.03,
  "executionLimitOffset": 15.0,
  "stateTransitionThreshold": 0.01,
  "orderQuantityInUSD": 300.0,
  "orderQuantity": 5,
  "contract": {
    "symbol": "BRO",
    "secType": "STOCK",
    "currency": "USD",
    "exchange": "IBKR"
  },
  "price_contract": {
    "symbol": "BRO",
    "secType": "STOCK",
    "currency": "USD",
    "exchange": "IBKR"
  },
  "ledgerPath": "data/TraderLedger/CSO_SP500_300_BRO_TWS",
  "ledgerContextCollection": "CSO_SP500_300_BRO_TWS_context"
}
