{
  "strategy_type": "ConstantStepOffset",
  "baseline": 129.98,
  "stepDelta": 0.06,
  "executionLimitOffset": 30.0,
  "stateTransitionThreshold": 0.01,
  "orderQuantityInUSD": 300.0,
  "orderQuantity": 2,
  "contract": {
    "symbol": "EOG",
    "secType": "STOCK",
    "currency": "USD",
    "exchange": "IBKR"
  },
  "price_contract": {
    "symbol": "EOG",
    "secType": "STOCK",
    "currency": "USD",
    "exchange": "IBKR"
  },
  "ledgerPath": "data/TraderLedger/CSO_SP500_300_EOG_TWS",
  "ledgerContextCollection": "CSO_SP500_300_EOG_TWS_context"
}
